author,published_at,comment,like,en_comment
@Koplak-d3y,2024-06-15T17:01:55Z,jokowi emang mantab banyak bukti yang di rasakan masyarakat hanya orang orang yg ngak suka yg bikin onar biar semua macet kebanyakan demo protes dlln yang ngak penting buat gaduh fakta presiden jokowi nyata bukan omong kosong,0,jokowi is really good there is a lot of evidence that the public feels only people who dont like it make trouble so that everything gets stuck mostly demos protests etc that are not important make a fuss the facts of president jokowi are real not nonsense
@JembatBaru,2024-06-15T17:33:08Z,iya betul betul mantap mewariskan hutang yg mencekik leher rakyat mampukah si wowo tuk melunasinya,0,yes its really strong to inherit the debt that strangles the peoples necks can wowo pay it off
@suhonomas7946,2024-06-15T17:01:25Z,menclamencle dulu diawal pembangunan ikn jokowi begitu percaya diri detik perayaan hut ri dipusatkan di ikn,20,menclamencle at the beginning of the construction of the ikn jokowi was so confident that the indonesian independence day celebrations would be centered at the ikn
@susiadmo8043,2024-06-19T00:02:57Z,proyek apapun di dunia pasti punya target jika target meleset itu hal biasa terkait apapun sebabnya conyoh kereta cepat california molor dari th hingga kini belum selesai biaya semula b naik b dan th naik lagi menjadi b demikian juga kereta cepat hsr london manchester molor an tahun dan sekarang dihentikan dan masih banyak lagi contoh di dunia ini,0,any project in the world must have a target if the target is missed it is normal regardless of the reason for example the california highspeed train has been delayed from until now it has not been finished the original cost was b increase to b and in it will increase again to b similarly the hsr highspeed train london manchester has been delayed for years and is now stopped and there are many more examples in this world
@sportschannel7547,2024-06-15T16:59:36Z,tolpolll,0,tolpolll
@unknown-k8d2c,2024-06-15T16:58:17Z,i hhhhk ayaknyan geriikn,0,i hhhhi thinkn scaryikn
@Mellowship1,2024-06-15T16:56:57Z,yah duo dungu asian value nongol lagi,1,well the dumb asian value duo is showing up again
@Awi-ym7yy,2024-06-15T16:56:50Z,anak sama istri ngabalin ini apa engga malu liat ngabalin ini ngibul ya,0,ngabalins wife and children are not ashamed to see ngabalin lying
@YudhaHarwan,2024-06-15T16:55:45Z,salam asian value,8,salam asian value
@NaomiLiling,2024-06-17T06:39:09Z,buru buru nanti kesandung,0,hurry up or youll stumble
@jorankalbarfishing9126,2024-06-15T16:55:31Z,saya orang kalimantankalian nggak tau dampak luar biasa besar yg ada di kalimantan tempat kalian jalan tol di mana kami apa jalan masih pasirtanah sejak pembngunan ikn jalanjembatan jadi bagusperekonomian pun ikut menaik ingat keadilan kalian di jawa uwih banjir ngeluh apa pernah kalimantan banjir ngeluh,3,i am a kalimantan person you do not know the extraordinary impact that exists in kalimantan where is the toll road in your place what is ours the road is still sand soil since the construction of the road icon the bridge is good the economy is also increasing remember justice you in java you are complaining about floods has kalimantan ever complained about floods
@firmancatfir_nemo9880,2024-06-15T17:18:49Z,kalimantan itu butuh infrastruktur dasar utamanya air bersih,1,kalimantan needs basic infrastructure especially clean water
@ulisitorus1267,2024-06-15T20:56:57Z,semogo orang kalimantan asli hidup sejahtera dengan adanya ikn dan bisa tinggal dekat istana bukan orang dari luar kalimantan apalagi dari luar indonesia jgn sampai orang luar kalimantan hidup di istana tapi orang kalimantan tinggal di pinggiran atau di hutan,1,hopefully the native kalimantan people live prosperously with the existence of ikn and can live near the palace not people from outside kalimantan let alone from outside indonesia dont let people from outside kalimantan live in the palace but kalimantan people live on the outskirts or in the forest
@eniewulan6899,2024-06-15T23:22:46Z,pd dasarnya rakyat stuju ibukota pindah tp gsk ujug cm thn harus jadi smntara uang aja gk punya uang boleh utang trus yg bayar utang rakyat ini yg di maksud pemerataan pembangunan ikn diatas penindasan rakyat,0,basically the people agree that the capital city should be moved but it doesnt happen until years later while they dont even have money they can borrow money and then the people pay the debt is this what is meant by equality the development of the ikn is based on the oppression of the people
@editorizal,2024-06-16T01:54:27Z,eniewulananda dan banyak seperti anda berfikir tanpa dasar pahami dulu rencana induknya ikn itu dibangun bertahap sampe dan tahun ini selesai tahap,1,eniewulanyou and many like you think without basis understand the master plan first the ikn is built in stages until and this year stage will be completed
@fadilahakbar9941,2024-06-16T04:42:32Z,bener nih ikn sangat berdampak bagus maka dari itu ayo kita ikut menyumbang ke negara melalui tapera dan pajak yang tinggi supaya bisa membantu apbn yang defisit,0,thats right this ikn has a very good impact so lets contribute to the country through tapera and high taxes so that we can help the apbn which is in deficit
@akhmadilarba7578,2024-06-15T16:53:57Z,sikap sigundul tuyulnya anies bernarasi seenak udelnya untyng anies kalah kalau menang sigundul tuyul ini aksn menghabidkan uang negara,0,anies bald tuyul attitude is narrating as he pleases if anies loses if he wins this bald tuyul will waste state money
@JatnikaEmpi-v9b,2024-06-15T16:53:39Z,ngabalinitu tkobat dipasar dulunya ya,0,ngabalin was that medicine available in the market before
@Koplak-d3y,2024-06-15T16:52:43Z,yg lebih tau yg menjalankan proyek ikn yang sok tau sok pintar ngak tau apa apa itu si komentar,0,the one who knows better is the one who runs the ikn project the one who pretends to know and is smart and doesnt know anything is the commenter
@JatnikaEmpi-v9b,2024-06-15T16:51:19Z,alm rizal ramli bilang proyek ngelindur jkwi otu,0,the late rizal ramli as a project to shield jkwi otu
@ruusthereisjemarllyn3477,2024-06-15T16:49:55Z,mungkin kah membangun sebuah ibu kota baru dalam sekejapppp mimpi buruk atau mimpi mulukkkk apalagi disebuah pulau yang memiliki budaya yang sangat keras aq cinta orang dayak mereka harus tetap exist,20,is it possible to build a new capital city in an instant nightmare or grandiose dream especially on an island that has a very harsh culture i love the dayak people they must continue to exist
@SugengBrama-qi3dn,2024-06-15T19:09:46Z,ikn bermasalah anehnya bangunan belum selesai kok mau di gunakan untuk upacara agustus proyek proyek yang sudah bisa di gunakan itu setelah diresmikan,0,ikn is problematic strangely the building is not finished yet but it is going to be used for the august th ceremony the projects that can be used are after being inaugurated
@Yusaedi,2024-06-16T00:00:34Z,bukan muluk atau buruk itu namanya grsa grusu ego kessu pengen kesohor ujungnya banyak cerita ooong pengen kesohor,0,its not grandiose or bad its called being hasty being egotistical wanting to be famous in the end there are lots of stories oh i want to be famous
@EnnyJogjes,2024-06-16T00:53:20Z,sugengbramaqidnjokowi memaksakan diri di ikn krn jokowi pengin di kenang setelah lengser dgn ikn nya itu mslhnya jd biar anak cucu kita ingat ikn ingat jokowi,1,sugengbramaqidnjokowi forced himself in the ikn because jokowi wanted to be remembered after stepping down with his ikn thats the problem so that our children and grandchildren remember the ikn and remember jokowi
@editorizal,2024-06-16T01:52:36Z,sugengbramaqidnyg penting bukan masalah korupsi ikn masalahnya kecil cuma lahan hektar dari total ribu,0,sugengbramaqidnyg whats important is not the issue of corruption the ikn issue is small only hectares of land out of a total of thousand
@JaysSabar,2024-06-16T02:44:21Z,yusaedi congor loe terlalu kenceng urus aja kerjaan loe supaya kluarga loe bisa makan,0,yusaedi youre too busy just take care of your work so your family can eat
@jupitersatuvenus7125,2024-06-15T16:40:53Z,saya turunan perantauan yg lahir dan tinggal di balikpapan puluhan tahun saya generasi ke dan anak saya yg ke dan bakal lahir generasi ke menyaksikan sendiri tahun terakhir melesatnya perkembangan kota balikpapanpasti sebentar saja ikn melesat jua dalam waktu tahun balikpapan dihuni oleh berbagai suku dan bahasa ikn akan sama,0,i am a descendant of migrants who was born and lived in balikpapan for decades i am the rd generation and my child is the th and will be the th generation witnessing the rapid development of balikpapan city for the last years surely the capital city will also soar in years balikpapan is inhabited by various tribes and languages the capital city will be the same
@widjihindariwati4820,2024-06-15T17:05:48Z,dua tahun yg lalu saya ke tenggarong jalannya bogang,0,two years ago i went to tenggarong the road was bumpy
@jupitersatuvenus7125,2024-06-16T11:08:40Z,widjihindariwati ya ke tenggarongjauh itu brolewat loa janan ya bogang bogangcoba lewat samarinda ke tenggarong mulus jalannya dan cepat sampai,0,widjihindariwati yes to tenggarongits far bropassing loa janan bogang bogangtry going through samarinda to tenggarong the road is smooth and you get there quickly
@gempurtukiditukidi7707,2024-06-15T16:36:06Z,pengumuman dari bp rt besuk hari minggu di harap warga rt kerja bakti bersih lingkungan sekitar masjid untuk persiapan idul adha dan korban,0,announcement from the rt head tomorrow is sunday residents of rt are expected to work together to clean the area around the mosque in preparation for eid aladha and the victims
@Kamalshah-n7m,2024-06-15T16:35:00Z,persen siap tu istana president bukan nya ikn,0,percent ready for the presidential palace not the ikn
@CokMuter,2024-06-15T16:33:12Z,nanti untuk pejabat pegawai yg tidak mau menetap di ikn akan disiapkan pesawat gratis untuk angkutan para prtugas pulang pergi paling jam perlu waktu,0,later for officials and employees who do not want to stay in ikn free planes will be provided to transport the officers round trip at most it will take hour
@keluargaygsakinah4621,2024-06-15T16:32:28Z,pak ngambalin mantap yg satunya si kakek itu kayanya golonganya yang onoh kelihatan dari bicaranya kaya ngledek begitu,0,sir the other one is a great old man it seems like hes from the onoh group it can be seen from his speech that hes teasing me
@hasrulrasyid3951,2024-06-15T16:29:55Z,mana suaranya yang pilih sama,0,which vote will choose or
@fajarirwanto-st6bs,2024-06-15T16:52:40Z,mungkin buat aku sebagai pembelajaran dlm menentukan pilihan supaya tidak kelirumaaf selama ini aku menjadi pendukung yg telah dikecewakannya,0,maybe for me its a lesson in making choices so i dont make mistakes im sorry that all this time ive been a supporter who has been disappointed
@chanelzuldar2140,2024-06-15T16:28:44Z,orang kecil bicara hal hal yang kecil mrt lrtwhoose itu semua bukan anis beliau hanya mengintegrasikan saja,0,small people talk about small things mrt lrtwhoose all that is not anis he just integrates
@Purwadi07,2024-06-15T16:28:19Z,mukanya nyambelin jiwanya medisin bibirnya majuin,0,his face was sweet his soul was healing his lips were moving forward
@jupitersatuvenus7125,2024-06-15T16:28:11Z,international network yg berhubungan dgn investasi asing dipimpin pak bambang mantan kepala otorita ikn sungguh tepat karena pak bambang berpengalaman dibidangnyauntuk luar negerijakarta mau tenggelam oleh air laut dan turunnya tanah akibat air tanah tergerus diambil untuk keperluan orang banyak jakartajakarta kota terpadat no sekian di duniastudi kelayakan sudah dilakukan coba undang bpk bambang brojonegoro dan bpk andrinov chaniago yg menangani amdal tsbpakar pencetus terbentuknya ikn,1,the international network related to foreign investment led by mr bambang the former head of the ikn authority is truly appropriate because mr bambang is experienced in his fieldfor overseasjakarta is about to be submerged by sea water and the land is sinking due to groundwater being eroded and taken for the needs of the people of jakartajakarta is the most densely populated city in the worlda feasibility study has been carried outtry inviting mr bambang brojonegoro and mr andrinov chaniago who handled the environmental impact analysisthe experts who initiated the formation of the ikn
@rahmachannel123,2024-06-15T16:28:04Z,setelah upacara terus ditinggalkan karena duitnya habis dipakai bansos pemilu,0,after the ceremony was abandoned because the money was used up for social assistance for the election
@bandibandi9715,2024-06-15T16:24:27Z,kalau menurut pendapat saya yang perlu di benahi itu pemberantasan korupsi karena sumber dari segala sumber kebobrokan itu adalah korupsi ini malah yang di urus malah sumber lainnya yang bisa menimbulkan bisa di korupsi itu pendapat saya,0,in my opinion what needs to be fixed is the eradication of corruption because the source of all sources of corruption is corruption but what is being taken care of is other sources that can give rise to corruption that is my opinion
@WakDer-xj8ul,2024-06-15T16:21:55Z,ngabalin kalo ngomong tetap bohonghe he,0,ngabalin if you say its still a liehe he
@jupitersatuvenus7125,2024-06-15T16:17:47Z,ikn pusat pemerintahan bukan pusat perdaganganbukan pusat pabrikya ikn kota modern kota administrasipemerintah tidak bisa menjual tanah negara kepada siapapuntanah negara kog dijual,0,ikn is the center of government not a trade centernot a factory centeryes ikn is a modern city an administrative citythe government cannot sell state land to anyonehow can state land be sold
@widiatmopetrus3444,2024-06-15T16:17:42Z,kalau ikn blm siap pindah ibu kota ke solo sunan membiayai keuangan ri spt sultan hb ix biayai ri saat ibukota pindah yogyakarta ingat uu jakarta sdh dicabut sbg ibu kota,0,if the ikn is not ready move the capital to solo sunan finances the ri finances like sultan hb ix finances the ri when the capital moves to yogyakarta remember the law jakarta has been revoked as the capital
@Purwadi07,2024-06-15T16:17:27Z,hanjur negeri ini otakmu tak sebanding hatimu,0,its a shame that in this country your brain is not as good as your heart
@sumiyaturn5910,2024-06-15T16:16:40Z,bayangan itu sama dg hayalan,0,the shadow is the same as the dream
@minnizachra9916,2024-06-15T16:16:07Z,pertanyaan jg apakah probowo mau melanjutkan wlo awal ketika msh capres mo melanjutkan yg blm tahu berapa anggaran nya tuk melanjutkan sementara anggaran yg sdh za begitu menghabiskan banyak sekali tp blm selesai semua nya kita tonton za gimana prabowo akan melanjutkan krn ada isyu kt nya gak sanggup,0,the question is also whether prabowo wants to continue even though at the beginning when he was still a presidential candidate he wanted to continue what is not yet known is how much the budget is to continue meanwhile the budget that has been spent is so much but it is not all finished lets see how prabowo will continue because there is an issue that he is not able to
@jupitersatuvenus7125,2024-06-15T16:14:06Z,yakin yg datang ke ikn anak anak bapak bapak dan ibu ibukalau bpk dan ibu tak mau tinggalkan zona nyaman nyaman yg sekarangkalau mau maju harus tinggalkan zona nyaman jakarta perlahan akan tenggelam oleh air lautgula jakarta yg mengundang semut semut kiasan untuk berkumpulnya banyak orang membuat air tanah tergerus tanah menurunbaguslah ikn diciptakandi kaltim di tengah wilayah indonesia,10,surely those who come to the ikn are the children of fathers and mothersif you dont want to leave your comfort zone the current comfortif you want to progress you have to leave your comfort zonejakarta will slowly sink by sea waterjakartas sugar that invites antsa metaphor for the gathering of many people causes groundwater to erode the land to sinkits good that the ikn was createdin east kalimantan in the middle of indonesia
@hadisubhan9708,2024-06-17T06:02:33Z,sok tau,0,many tau
@jupitersatuvenus7125,2024-06-17T08:27:54Z,hadisubhan huhuhuorang yang mau di zona nyaman terus tuh kayak lu,0,hadisubhan huhuhupeople who want to be in the comfort zone are like you
@andreassuhariyo1141,2024-06-15T16:13:08Z,ikn musti segera dipercepat pembukaan n segera ditempati oleh presiden n jajarannya krn dimata dunia usaha akan bertambah pd berinfestasi kluu perlu pemberlakuan reward n punishment bagi yg menolak ke ikn khususnya kabinet terpilih krn apbn sudah cukup besar mendanai pewujudan ikn dan mjd bentuk pertanggung jawaban kpd masyarakat,0,ikn must be immediately accelerated in opening and immediately occupied by the president and his staff because in the eyes of the business world it will increase the confidence to invest if necessary the implementation of rewards and punishments for those who reject the ikn especially the elected cabinet because the apbn is already large enough to fund the realization of the ikn and become a form of accountability to the community
@umarabdulaziz7239,2024-06-16T05:10:41Z,hrslah skrg aja gas pindah jokowi dan kroni jg yg persen wajib gas ke ikn dan nyumbang tapera buat ikn yg persen bebas,0,jokowi and his cronies should move the gas now also the percent who are required to move the gas to ikn and donate tapera for ikn the percent are free
@john34965,2024-06-17T14:07:37Z,kenapa rumah pensiun jokowi kok di jawa kenapa dia gak milih rumah pensiunnya di ikn makanya saya sadar ikn ini cuma lahan korupsi yang dibela buzzer pemerintah untu mengelabui orang guoblok kayak elo,0,why is jokowis retirement house in java why didnt he choose his retirement house in the city thats why i realized that this city is just a field of corruption defended by government buzzers to deceive stupid people like you
@zidanzi-cn7fu,2024-06-15T16:13:03Z,acara pendukung istana,0,palace support event
@tejotok,2024-06-15T16:11:17Z,ahirnya ngabalin bisa bicara lumayan lunak gak nyrocos lagi,2,finally ngabalin can speak quite softly and doesnt babble anymore
@hierel6212,2024-06-15T16:10:57Z,cnn kok masih ngundang narasum penjilat bersorban yg gak fair kurang mutu,0,why is cnn still inviting turbaned sycophants who are unfair and lacking in quality
@amirudin4906,2024-06-15T16:10:23Z,saya sendiri tinggal di balikpapan dan meiihat pembangunan ikn seperti apa malu melihat bahasanya ngobelin,67,i myself live in balikpapan and see what the development of ikn is like im embarrassed to see the language ngobelin
@editorizal,2024-06-16T01:56:47Z,anda tinggal di balikpapan bukan di ikn jadi ga bisa dipercaya sepenuhnya apalagi ikn itu wilayah berizin dikunjungi anda siapa tahu kondisi ikn wps channel dan dian rana youtuber yg kerja di lapangan lebih saya percaya,7,you live in balikpapan not in the ikn so you cant fully trust it especially since the ikn is a permitted area to visit who knows the condition of the ikn i trust wps channel and dian rana youtuber who work in the field more
@pak35872,2024-06-16T04:37:06Z,bahasanya ngabalin jadi ngibulin aku baca,5,the language is so confusing that its fooled me to read it
@pak35872,2024-06-16T04:39:48Z,editorizalsy percaya sen aoa yg dikatakan mas ini udah bisa dibaca dg kemunduran dua org pentig aku baca,3,editorizalsy i believe cent what this guy said can be read with the decline of two important people i read
@geogorden7244,2024-06-16T05:59:44Z,editorizal mmg sulit menjelaskan pada pemuja jokowi yg rata bersumbu pendekpembohong sampai kapanpun ya ttp pembohongsblom jd presiden sdh pembohong besar kok msh dpuja,8,editorizal its really hard to explain to jokowis fans who are generally shorttempereda liar will always be a liarbefore he became president he was already a big liar but people still adore him
@editorizal,2024-06-16T06:52:44Z,pak mereka mundur tp ketuanya balik lagi kerja jd utusan khusus internasional ikn udh baca dan mereka mundur tetap mendukung pembangunan ikn katanya itu adalah peradaban masa depan dan visi indonesia emas mereka bilang begitu udh baca,1,pak they resigned but the chairman returned to work as a special international envoy for the ikn have you read it and they resigned but still support the development of the ikn they said it is a future civilization and the vision of indonesia emas they said that have you read it
@MuhammadRidho-vo6uy,2024-06-15T16:10:05Z,sdh lah pak wiwibwrhenti berbohong berbohongtobatlah pak wiwi,1,come on mr wiwistop lying lyingrepent mr wiwi
@minnizachra9916,2024-06-15T16:10:02Z,rencana yg blm tentu apalg akan mengundang di duga megawati tdk akan di undang wallahu alam,0,the plan is not yet certain let alone inviting it is suspected that megawati will not be invited god knows best
@sriharnati5227,2024-06-15T16:09:26Z,bacot mu ngabalin menjijikkan klau rakyatnya sdah makmur biaya hidup sdsh terpenuhi ga masalh mau membuat ikn baru balegugg,0,your rant is disgusting if the people are already prosperous and their living expenses are met theres no problem in making a new icon balegugg
@URAT_SARAF,2024-06-15T16:08:25Z,indonesia sentris jaman now not geographic ngabaling,0,indonesia centric now not geographic ngabaling
@minnizachra9916,2024-06-15T16:08:07Z,ngabalin yg sering cari pemcitraan semenjak masuk istana sblm masuk tahu sendiri narasi nya,1,ngabalin who often seeks image building since entering the palace knows the narrative himself before entering
@URAT_SARAF,2024-06-15T16:07:49Z,kok bisa sebodoh ngabaling ini jadi jubir presiden di ksp wkwk,76,how can someone so stupid as to be the presidents spokesperson at ksp hahaha
@pak35872,2024-06-16T04:41:56Z,klo org pinter bener ga dipercaya ha ha ha aku baca,6,if a person is really smart they wont be trusted ha ha ha i read that
@masadamsahid,2024-06-16T11:26:31Z,yang milih dia jadi ksp emang pinter,5,the one who chose him to be ksp is really smart
@EliyaYahzina,2024-06-17T02:31:07Z,sengaja disodorkan kek model ngabalin biar yg lain gak fokus,3,it was deliberately presented like the ngabalin model so that others wouldnt focus
@ketutsemadi6370,2024-06-17T03:59:56Z,supaya nurut kl disuruh,2,so that you obey when told
@nadazen1957,2024-06-17T06:03:56Z,karena paling jinak kalo di gembala,2,because its the most tame when its shepherded
@masdisuwandihusen7838,2024-06-15T16:07:28Z,si ngabalin itu sorbannya ga copot ga cocok tuh orang pake sorban krn akhlaknya sangat jelek,0,that guy ngabalins turban wont come off its not right for that person to wear a turban because his morals are very bad
@nryarhar1101,2024-06-15T16:07:10Z,dalam dinasti politik aplagi family yg sdg masjab belum berakhir tidak ada kesetaraan antar sesama warga negara apalagi dengan warga biasa jelas melanggar human rights asian value itu maju kontestasi disaat family sdg berkuasa hormat kpd baginda yth sipaling asian value,8,in a political dynasty especially a family that is still in power there is no equality between fellow citizens let alone ordinary citizens which clearly violates human rights asian values advance contestation when the family is in power respect to your majesty the most asian value
@FRHN-is4xw,2024-06-15T16:07:09Z,ada asian value human rights,1,ada asian value human rights
@damarbagussetio4143,2024-06-15T16:11:52Z,jadi inget podcast,1,reminds me of podcast
@FRHN-is4xw,2024-06-15T16:17:09Z,damarbagussetio hahahha,0,damarbagussetio hahahha
@sulkansulkan1694,2024-06-15T16:07:02Z,sebagai rakyay kecil sangat sedih ketika pejabat berurusan hukum prosesnya sangat ribet beda jika rakyat kecil yg berurusan dngn hukum langsung masuk kandang,0,as a commoner it is very sad when officials have to deal with the law the process is very complicated it is different if the commoner has to deal with the law and is immediately put in a cage
@amirudin4906,2024-06-15T16:06:55Z,bahasa utamakan kepentingan rakyat hanya bunga bibir pak de ikn hanya kota bayangan,0,prioritizing the interests of the people is just lip service mr de ikn is just a shadow city
@a2n56,2024-06-15T16:06:43Z,korupsi human right,0,human rights corruption
@jupitersatuvenus7125,2024-06-15T16:06:04Z,mundur berdua karena belum ada pemerintahan di iknpemerintahan ada jika ada wilayah sistem pemerintahan dan orang orang didalamnya nggak ada orangjadi belum maksimal memerintahyg jelas masih masif pembangunanya pak basuki ajalah dulu yg memimpinwajartugas baru mantan ketua otorita ikn yg sekarang lebih tepatcari investor asing untuk ikninvestor asing diundang setelah konstruksi dasar selesai tahap irumah sakit bank sekolah rumah ibadah jalan irigasi bendungan air listrik rumah asn tni polri yudikatif execitive legislatif istana presiden kantor mall pasar bandara vvip mall dll selesaibaru masuk infrastruktur dan teknik modern yg mengisi suatu ibu kotaplus orang orangnya,0,both of them resigned because there is no government in the ikna government exists if there is a region a government system and people in itthere are no peopleso it has not been able to govern optimallywhat is clear is that development is still massiveyes mr basuki is the only one who will leadits naturalthe new task of the former ikn authority chairman who is now more appropriatefind foreign investors for the iknforeign investors are invited after the basic construction is completed in phase ihospitals banks schools places of worship roads irrigation water dams electricity asn houses tni polri judiciary executive legislative presidential palace offices malls markets vvip airports malls etc are finishedthen enter the infrastructure and modern techniques that fill a capital cityplus the people
@sriharnati5227,2024-06-15T16:05:37Z,muak ngelihat muks sungabalin,86,sick of seeing muks sungabalin
@JaysSabar,2024-06-16T02:42:06Z,loe kan piaraan si roky garong makannya loe gk suka ngabalin yg koment di sini ada dua kubu samasaling hina dan saling benci,0,youre rokys pet the thief so you dont like to gossip the people commenting here are in two camps they insult and hate each other
@diaszaretta9596,2024-06-17T06:26:58Z,sama,8,same
