author,published_at,comment,like,en_comment
@elsakyu1133,2024-08-19T04:07:59Z,mantap,0,steady
@alirosheno9473,2024-08-19T03:52:44Z,sumpah selama ini ketipu hoax grup wa keluarga yang isinya pendukung anis yang bilang ikn mangkrak lah ikn masih hutan rata tanah alias belum dibangun ternyata sekeren itu ikn cepat sekali progresnya semoga makin maju indonesiaku,1,i swear all this time ive been fooled by the hoax family wa group whose members are anis supporters who said that the ikn is stalled the ikn is still a forest that has been leveled to the ground aka it hasnt been built yet it turns out that the ikn is that cool its progress is very fast hopefully my indonesia will continue to advance
@erlanggasetyohadi6497,2024-08-19T03:48:47Z,untung pak prabowo menang pasti bakal lanjut sampai tuntas ikn ini kalo yg menang si anis pasti bakal mangkrak sih ikn soalnya pengen bikin kota setara kota jakarta dan bbm gratis,1,luckily mr prabowo won he will definitely continue to complete this ikn if anis wins the ikn will definitely be stalled because he wants to make cities equal to jakarta and free fuel
@wrstudio2153,2024-08-19T03:40:59Z,alhamdulillah semoga allah senantiasa menjaga melindungi merahmati bangsa dan negara indonesia amiin,0,alhamdulillah may allah always protect and bless the indonesian nation and country amen
@DediMulyadi-j7j,2024-08-19T03:25:24Z,adakah sejarah atau narasi mencatat tentang penyerahan hak pakai atas istana negara dan istana merdeka dari pemerintah kolonial ke pemerintahan nkri atau azas manfaat belaka karena kolonial hengkang jadi lumayan lah diperbaharuii setelah itu dipakai,0,is there any history or narrative that records the transfer of usage rights over the state palace and the independence palace from the colonial government to the government of the republic of indonesia or is it just a matter of benefit because the colonial government left so it was quite good to renovate it after that it was used
@murnij6111,2024-08-19T03:22:35Z,trimah kasih pak joko widodo sehat sll dn panjang umur,0,thank you mr joko widodo stay healthy and live a long life
@heldayun3820,2024-08-19T02:44:41Z,sukses selalu ikn wujud nyata karya anak bangsa tuhan memberkati,4,always be successful ikn is a real manifestation of the work of the nations children god bless you
@yemmyadiyatma333,2024-08-19T02:19:07Z,biasa aja dulu tunggu sampai berfungsi sesui harapan dan negeri ini bs byar hutang nya klu gak bs dan kesusahan apa si surya paloh nasdem mau bantuin bayar hutang negeri ini,0,just be normal for now wait until it works as expected and this country can pay off its debts if it cant and there are difficulties surya paloh nasdem will help pay this countrys debts
@agusnurr5339,2024-08-19T02:15:08Z,coba kasih komen dong ttg jokowi yg kasih hgu yg bisa selama mungkin saja tanah yg mereka kuasai dg hgu akhirnya tanah dimiliki penuh dan cina yg menguasai ikn,0,try to give a comment about jokowi who gave hgu which can last for maybe the land that they control with hgu will eventually be fully owned and china controls the ikn
@yuliantogp,2024-08-19T02:14:24Z,mantap,0,steady
@sukarmin3840,2024-08-19T01:53:08Z,subhanallah terima kasih ya allah atas kuasamu negara kami tercinta mampu membangun ibu kota baru ikndirga hayu indonesi rahayu rahayusemoga para pemimpin negara yg membangun ikn selalu di berikan kesehatan amin,0,subhanallah thank you o allah for your power our beloved country is able to build a new capital city of ikn
@dimasrezikyjaelani4415,2024-08-19T01:35:28Z,buzzer gausah nonton soalnya primitif apalagi cuman sbagai alat demokrasi yg bahkan junjungannya pun hampir dikhianati oleh partai politik,0,buzzer dont watch it because its primitive moreover its only a tool of democracy whose leader was almost betrayed by a political party
@bontetabadi1027,2024-08-19T00:38:21Z,tempat saya belum ada listrik jalan belum diaspal,0,my place doesnt have electricity yet the roads arent paved
@deaservice735,2024-08-19T14:38:26Z,dana desanya dikemanain,1,where did the village funds go
@dedediancahyadi5345,2024-08-19T00:20:15Z,tumben nih metro tv judulnya adem,0,its rare for metro tv to have a cool title
@mayonjik,2024-08-18T23:45:42Z,alkhamdulillah bangsa indonesia sdh punya ikn hasil karya putra putri indonesia berkat presiden joko widodo beserta jajarannya majulah indonesiaku,0,thank god the indonesian nation now has an ikn the work of the sons and daughters of indonesia thanks to president joko widodo and his staff advance my indonesia
@rifaafelina1264,2024-08-18T23:41:54Z,membangun segitu aja beritanya gak abis kau lihat di arab saudi malaysia midianya gak kepo,0,just building that much the news is never ending you see it in saudi arabia malaysia the media is not curious
@deaservice735,2024-08-19T14:42:25Z,kamu apa orang asing ya yg tidak menghargai negara nya sendiri,0,are you a foreigner who doesnt respect his own country
@reftahdsb2393,2024-08-18T23:37:35Z,wah keren sekali,0,wow thats so cool
@ferrygunawan9301,2024-08-18T23:21:08Z,baru tahu ya pemirsa itulah hebatnya visi misi bpk jokowi dgn semboyan indonesia bisa,0,just found out viewers thats the greatness of mr jokowis vision and mission with the motto indonesia can
@tvadekaka7559,2024-08-18T21:42:26Z,waow ikn keren salam sukses berkah sehat dari tvade kaka,1,wow cool icon greetings of success and healthy blessings from tvade bro
@yudiwahyudi5956,2024-08-18T19:10:05Z,kami bggaacungu jempool krn jetegasan keberanuan seorg pemimpin yg sabar tp pasti,0,we are proud and give you a thumbs up because of the firmness and courage of a patient but sure leader
@BarokahJaya-v2t,2024-08-18T18:21:37Z,alhamdulillah kita bisa mewujudkan cita cita leluhur para pahlawan pejuang th yg lalu atas ridhoh allah swt dan berkahnya unuk negri nusantara indonesia amin,13,alhamdulillah we can realize the ideals of our ancestors the heroes who fought years ago with the permission of allah swt and his blessings for the indonesian archipelago amen
@rena_nounen,2024-08-18T16:37:30Z,cie yg merapat skrg narasi nya berbeda ni gak tahan oposisi yeee,0,wow those who have come closer now have different narratives they cant stand the opposition huh
@SuliungSuliung,2024-08-18T16:34:24Z,listrik gk ada pom bensin,0,electric no gas stations
@wayansubrata6942,2024-08-18T16:20:59Z,katanya membangun kota kelas dunia nah kok blm ada sy dengar rencana utk membangun jaringan tol free emergency call ini gimana bpk otorita ikn,0,they said they are building a worldclass city well how come i havent heard any plans to build a toll network with free emergency calls how about this mr otorita ikn
@marylampung8847,2024-08-18T16:00:33Z,masya allah begitu megah dan sangat indah bngt ikn luar biasa keindahan nya semoga indonesia semakin jaya makmur sejahtera terimakasih atas kepempimpinan bpk presiden jokowi selama tahun sehat sehat dan sukses selalu bpk presiden jokowi sekeluarga besar dan seluruh jajarannya,1,masya allah so magnificent and very beautiful ikn its beauty is extraordinary hopefully indonesia will be more prosperous and prosperous thank you for the leadership of mr president jokowi for years always be healthy and successful mr president jokowi his extended family and all his staff
@PakBoy22-tq4pj,2024-08-18T15:47:44Z,bagus ikn sekarang sudah banjir,0,good icon now its flooded
@anwarsimanjuntakchannel5616,2024-08-18T15:42:59Z,si rocky iq itu terus aja menjelekkan ikn,0,rocky the iq keeps badmouthing the ikn
@kamso2981,2024-08-18T15:13:53Z,koar negara majuapa lu gk punya malu mana ada negara maju dg pejabat terkorup diduniakocak otak lu,0,bragging developed countrieshave you no shame where is there a developed country with the most corrupt officials in the worldyour brain is hilarious
@candrasigaung1348,2024-08-18T14:49:47Z,ad patung batman di sana di bilang indah,0,there is a batman statue there and it is said to be beautiful
@ArielSimanjuntak-n1z,2024-08-18T14:41:53Z,beda jauh sama jakarta,0,very different from jakarta
@muriyanto6224,2024-08-18T14:32:36Z,biasanya metro tv selalu memberitakan keburukan ikn ini kok malah kebalik yaa,0,usually metro tv always reports on the bad things about ikn but this time its the other way around
@ariefbudimanboyot4606,2024-08-18T14:24:38Z,ini baru transisi yng sehat demi indonesia maju sehat dan trimaka kasih atas bakti untuk negri slama ini bagi pemimpin bangsa yng akan usai masa bakti dan selamat dtng dan slamat bertugas kpda presiden terpilih smoga d tangan bapak indonesia dpat menjadi top global baru di dunia internasional,0,this is a new healthy transition for a healthy and progressive indonesia and thank you for your service to the country so far for the leaders of the nation whose terms of service are coming to an end and congratulations and good luck in your duties to the presidentelect hopefully in the hands of you indonesia can become a new global top in the international world
@juarnimundori5200,2024-08-18T14:16:41Z,saya dr semarang jawa tengah sungguh bangga dengan adanya i kn trimakasih bp presiden jokowi panjang umur sehat selalu tuhan yesus melindungi dan selalu memberkati semua keluarga bp presiden joko widodo amin amin amin,8,i am from semarang central java really proud of the existence of i kn thank you mr president jokowi long life always healthy lord jesus protects and always blesses all the families of mr president joko widodo amen amen amen
@Kakungsih,2024-08-18T14:05:36Z,mbah amin dan roky gareng diajak ke ikn biar wawasannya lebih luas mak mega hasto dan dedy sitorus jangan diajk ke ikn nanti sampe sana stroke malah ngerepotin orang sana,0,mbah amin and roky gareng were invited to ikn so that their vision would be broader mak mega hasto and dedy sitorus should not be invited to ikn later they will have a stroke and will bother the people there
@kenrudatin1354,2024-08-18T14:05:13Z,musiknya mengganggu sekali,0,the music is so annoying
@TheOne03-md1km,2024-08-18T14:04:17Z,saya nanti akan liburan bersama keluarga ke ikn,7,i will be on holiday with my family to ikn
@winnerwin641,2024-08-18T14:03:00Z,lihatlah yg selalu menghujat bapak jokowi semua sdh terwujut terimakasih bapak jokowi jasamu sungguh luar biasa,5,look at those who always criticize mr jokowi everything has come true thank you mr jokowi your services are truly extraordinary
@TheOne03-md1km,2024-08-18T14:02:07Z,benar benar rancangan kota masa depan kita semua akan sangat bangga dengan ikn maju indonesia jaya bangsanya dan sejahtera rakyatnya dalam kesatuan negara republik indonesia mari bersatu jaga nkri harga mati,1,it is truly a design for the city of the future we will all be very proud of the ikn advanced indonesia glorious nation and prosperous people in the unity of the republic of indonesia lets unite to guard the nkri the price is nonnegotiable
@sugeng.dwiyulianto,2024-08-18T13:54:37Z,go indonesia,0,go indonesia
@meybm5842,2024-08-18T13:43:15Z,presiden cerdas dan kuat,0,smart and strong president
@TheOne03-md1km,2024-08-18T13:36:11Z,merubah etos kerja dan melestarikan budaya nusantara tksh pak presiden jokowi usahamu dalam membangun indonesia akan sll dikenang sepanjang masamenuju indonesia maju modern dan sejahtera,6,changing the work ethic and preserving the nusantara culture thank you mr president jokowi your efforts in building indonesia will always be remembered for all timetowards a modern advanced and prosperous indonesia
@ismailmangngi9280,2024-08-18T13:32:15Z,sungguh menakjubkan merdeka,0,its amazing independence
@TheOne03-md1km,2024-08-18T13:27:26Z,dirgahayu indonesia merdeka,1,happy birthday indonesia independence
@mamaendang9854,2024-08-18T13:22:23Z,memang sdh kehendak allah swt harus ada ikn pak jokowi yg dipilih allah mewujutkannya pak prabowo subianto melanjutkan nya in sya allah,22,it is indeed the will of allah swt there must be an ikn mr jokowi who was chosen by allah to make it happen mr prabowo subianto continue it in sha allah
@mekshaaqlate673,2024-08-29T22:11:17Z,lah kocak indonesia masih miskin segitu doang kotanya yg dikatanya megah kok dibuat patung sayap burung sih negri maju malaysia dan negri lain terlalu sibuk membuat gedung pengcakar langit tertinggi di dunia eh malah konoha bikin sayap burung kocak btw gedung baru malaysia nomer dua tertinggi di dunia selepas burf khalifa belum lagi ngomong menara berkembar klcc dan lain megah kaya dunia semua salam ngakak dari warga maju malaysia buat konoha,0,indonesia is hilarious its still poor thats all the cities that are said to be magnificent why do you make statues of bird wings developed countries malaysia and other countries are too busy building the tallest skyscrapers in the world eh konoha even made hilarious bird wings btw malaysias new building is number two tallest in the world after burf khalifa not to mention talking about the klcc twin towers and others majestic like all the world big greetings from the advanced citizens of malaysia to konoha
@mamaendang9854,2024-08-18T13:18:50Z,seyogyanya ibu megawati bangga dg cita cita bpk presiden soekarnoyg sdh diwujudkan bpk presiden jokowittp kok ya pak jokowi dikuyo kuyosemoga pak jokowi sehat wal afiatjuga pak prabowo subiantosalam nkri,0,mrs megawati should be proud of the ideals of president soekarno which have been realized by president jokowi but why is mr jokowi being carried away i hope mr jokowi is healthy and well also mr prabowo subianto greetings from the republic of indonesia
@dedehermawan7606,2024-08-18T13:02:05Z,tar ob yang kerja di ikn tinggal dimana ya kan asn mah di sediakan apartemen cs sama ob di taro mana,0,where do obs who work at ikn live because asns are provided with apartments where do cs and obs live
@CodotMbalelo,2024-08-18T12:52:41Z,menyala merdeka,0,light up independence
@dedehermawan7606,2024-08-18T12:52:23Z,metro udah tau triknya sekarang mah biar banayak penontonnya yang begini kalo terus ada di oposisi sedikit penonton jika beritakan ikn,0,metro already knows the trick now to get a lot of viewers like this if it continues to be in opposition there will be few viewers if it reports on the ikn
@Toni-dz8lm,2024-08-18T12:41:55Z,luar biasa patut di banggakan slamaa,0,extraordinary worth being proud of salama
@Toni-dz8lm,2024-08-18T12:40:24Z,stadiun gbjkw,0,gbjkw stadium
@edo4830,2024-08-18T12:30:04Z,mantap bangun plts yang membabat hutan,0,great building a solar power plant that clears forests
@deaservice735,2024-08-19T14:57:08Z,gk ngaruh lbh ramah lingkungan dgn kendaraan listrik drpd bensin dan solar,0,it doesnt make sense that electric vehicles are more environmentally friendly than petrol and diesel vehicles
@edo4830,2024-08-19T15:31:47Z,deaservice yakin gak ngaruh berapa ribu hektar hutan yg dibabat itu baru tahap pertama bos,0,deaservice im sure it wont have any effect how many thousands of hectares of forest have been cleared thats just the first stage boss
@Vloganakcamping,2024-08-18T12:06:06Z,trimah kasih pak jokowikrn sudah membangun iknwalau banyak meremehkanmu mencemohmutetapi beliau sudah membuktikanyasemoga pak prabowo bisa melanjutkan pembanganunanya,0,thank you mr jokowifor building ikneven though many people look down on you and mock youbut he has proven iti hope mr prabowo can continue his development
@CodotMbalelo,2024-08-18T12:44:26Z,aminnn,0,amen
@bonaharmin,2024-08-18T12:05:16Z,mimpi bos,0,boss dream
@deaservice735,2024-08-19T14:59:13Z,mimpi menjadi kenyataan alhamdulillah,0,dreams come true thank god
@bonaharmin,2024-08-18T11:58:07Z,hebat luar biasa indonesia damai trimakasih bangsaku,0,great extraordinary indonesia is peaceful thank you my nation
@bisabet,2024-08-18T11:33:13Z,cari di google bisabet salam merdeka teman teman,0,search on google bisabet greetings independence friends
@ponimableck6478,2024-08-18T11:30:01Z,ikj untuk wilayah jakarta aja ikn untuk semua wilayah nusantara,0,ikj for jakarta area only ikn for all areas of the archipelago
@ekomujiono4111,2024-08-18T11:23:27Z,sungguh ironis uang rakyat di hambur hamburkan untuk sesuatu yang tidak penting,0,its ironic that peoples money is wasted on unimportant things
@giselasefti5837,2024-08-18T11:10:42Z,mungkin pak amin kepingin datang ke ikan nudantara,0,maybe mr amin wants to come to the nudantara fish
@tegcyadi1867,2024-08-18T11:10:16Z,tinggal menunggu musim hujan,0,just waiting for the rainy season
@budionopwdd117,2024-08-18T10:55:40Z,hebat kawanterutama teman tukang bangunanmaju teruss,3,great friends especially construction friends keep going
@budionopwdd117,2024-08-18T10:52:04Z,tidak ada presiden lain p jokowi emang jooos yg suka nyiyir omon nggk laku tuu si roky gerobolan si dedy sitorus,1,there is no other president mr jokowi is really cool he likes to gossip and say things that are not good roky and his gang dedy sitorus
@fandi-mc7wg,2024-08-18T10:48:10Z,sebagai pecinta arsitektur harapannya bangunan futuristik kayak gedung bi dan masjid ikn kedepannya lebih banyak lagi bangunan futuristik yg di bangun di ikn,0,as an architecture lover i hope that in the future there will be more futuristic buildings like the bi building and the ikn mosque
@icatpino1735,2024-08-18T10:43:18Z,hti fpi merontaronta pingin lepas bebas dari kandangnya,1,hti fpi struggling to break free from their cage
@narendrahatoguam2342,2024-08-18T10:37:31Z,jokowi is the best,1,jokowi is the best
@ernestbria9752,2024-08-18T10:16:22Z,terima kasih bapak joko widodo,1,thank you mr joko widodo
@syadewa9969,2024-08-18T09:24:28Z,bau kolonial adalah bau harum kelicikan yang sekarang di contoh oleh jokowiklw mau langgeng jabatan pakai lah sistem kolonial,0,the smell of colonialism is the sweet smell of cunning that is now being exemplified by jokowi if you want to stay in office for a long time use the colonial system
@fitrimulyani2879,2024-08-18T09:11:54Z,panel suryanya kayaknya kurang tinggi takutnya rumput dibawah panel akan mengganggu,1,the solar panels dont seem high enough im afraid the grass under the panels will get in the way
@MuhammadAndi-yf4vk,2024-08-18T08:56:44Z,adanya hut ri ke berarti menandakan ibukota negara indonesia adalah nusantara bukan jakarta disertai dimulai kegiatan aktif pemerintahan pusat secara bertahap dan berkelanjutan dikarenakan pembangunan gedung instansi pemerintah belum keseluruhan dibangun di wilayah ikn,1,the th anniversary of the republic of indonesia means that the capital city of indonesia is nusantara not jakarta accompanied by the gradual and continuous start of active central government activities because the construction of government agency buildings has not been entirely built in the ikn area
@DelinoLetsPlay,2024-08-18T08:56:29Z,terharu dan bangga inilah indonesiasehat selalu buat pak jokowi dan pimpinan negara lainya amiin indonesiamaju indonesianusantara indonesiamerdeka indonesiabhinekatunggalika indonesiapancasila merdeka,9,touched and proud this is indonesia always be healthy for mr jokowi and other state leaders amen indonesiamaju indonesianusantara indonesiamerdeka indonesiabhinekatunggalika indonesiapancasila merdeka
@fardikaakbar7983,2024-08-18T08:47:26Z,posisi nasdem sudah berbeda daripada bulan lalu metro tv juga mengikuti spertinya haha,0,nasdems position is different than months ago metro tv also seems to follow suit haha
@BernadusRodes,2024-08-18T08:42:06Z,sy optimis pasti beres dan nkri dimpin prabowo pasti semakin majuhebat,1,i am optimistic that everything will be okay and the republic of indonesia led by prabowo will become even more advanced and great
@Fitriyani-bp9mc,2024-08-18T08:23:11Z,salut bapak jokowi semoga selalu dalam lindungan allah subhana huataala dan indonesia semakin maju mari sama kita doa kan unt negara kita ini,0,salute mr jokowi may you always be under the protection of allah subhanahu wa taala and indonesia will continue to progress lets pray together for our country
@desneridedes9879,2024-08-18T08:20:08Z,menguki sejarah baru ikn buat nkri demi kejayaan dan wibawa nkri terimakasih pak jokowidodo perjuangan bapak tercatat dlm sejarah negara kita,0,creating new history ikn for nkri for the glory and prominence of nkri thank you mr jokowidodo your struggle is recorded in the history of our country
@m.dadangpurwanto7029,2024-08-18T08:06:39Z,anak telkom mana nih,0,where are the telkom kids
@bry3744,2024-08-18T08:00:59Z,safe zone buat para koruptor,0,safe zone for corruptors
@giveup34,2024-08-18T07:59:03Z,semoga rakyat semakin sejahtera dengan presiden yg bisa membangun negri ini beliau juga memikirkan dana yg minimalis,0,hopefully the people will be more prosperous with a president who can build this country and also think about minimal funds
@LisNawati-vo6yj,2024-08-18T07:58:50Z,alhamdulillahpak jokowi merdeka,1,thank god mr jokowi is independent
@HermanHerman-o6l,2024-08-18T07:50:04Z,calon presiden siapa sih yg gak mau berkantor yg gak mau ber istana di ikn si anies basyaman pun pasti mau tp sayang mencalon gubernur dki pun sdh mendekati gagal katanya suatu kehormatan kalo gerindra ikut mengusung dia jadi cagub setelah menilai bapak prabowo dri bisa nya tanpa rasa malu mau minta didukung gerindraprabowosorreee yeeee,0,who is the presidential candidate who doesnt want to work in an office who doesnt want to live in a palace in ikn anies basyaman would definitely want to but unfortunately running for governor of dki is already close to failure he said it would be an honor if gerindra also supported him as a gubernatorial candidate after rating mr prabowo out of how could he be shameless asking for gerindraprabowos supportsorreee yeeee
@anggarimam1673,2024-08-18T07:48:51Z,phk dimana mana tolong disorot jg,0,please highlight layoffs everywhere
@Yuliana-u3h,2024-08-18T07:40:02Z,indonesiaku hebat dengan dibangunnya ikn oleh presiden joko widodo,32,my indonesia is great with the construction of the ikn by president joko widodo
@mohkasiadi,2024-08-24T00:15:44Z,pk jokowi yes,0,pk jokowi yes
@Kini02,2024-08-18T07:33:51Z,hanya orang bodoh yg tidak bisa melihat bahwa jokowi adalah presiden terbaik dlm sejarah indonesia,1,only a fool cant see that jokowi is the best president in indonesian history
@hariyanto9919,2024-08-18T07:28:25Z,terimakasih pk jok ditangan bp nkri baru punya istana negara istana presiden dsb sendiri made in sendiri nkri bs bangga bs maju sejahtera adil makmur dan merata ijin usaha dipermudah utk warga masyarakt indonesia hgu utk rakyat sendiri yg diutamakan uang pengusaha di singapura hrs disimpan di bank indonesia tax amenity diperpabjang,0,thank you mr jok in the hands of mr nkri we just have a state palace a presidential palace etc made in ourselves nkri can be proud can progress prosper be just and prosperous and be evenly distributed business permits are made easier for indonesian citizens hgu for the people themselves are prioritized money of entrepreneurs in singapore must be deposited in indonesian banks tax amenities are extended
@YayanHartawan-e8l,2024-08-18T07:19:49Z,tims pak jokowi semoga menjadi amalibadah bapakbapaklan yang meletakan batu pembangunan semesta merata se nkrisukses selaluteriring doa semoga ptesiden selamjutnya meneruskan cita bapak,0,team mr jokowi may it be your good deeds sir you who laid the foundation for the development of the universe and the entire country always be successful accompanied by prayers that the next president will continue your ideals
@jimmyjim7113,2024-08-18T07:15:52Z,sejarah hitam sejarah buruk jkw,0,black history bad history jkw
@deaservice735,2024-08-19T15:05:45Z,ngiri nich yee,0,look here
@julieong391,2024-08-18T07:08:23Z,proud of you presiden ku bpk jokowijasa mu akan ku kenang selamanya,13,proud of you my president mr jokowi i will remember your services forever
@sutarmawirasasmita1199,2024-08-18T07:07:08Z,enak juga kan menikmati hasil pembangunan peninggalan colonial belanda yg sudah dinikmati oleh pemimpin nkri termasuk tahun dinikmati oleh presiden jokowi menikmati hasil pembangunan kolonial saja sudah begitu nikmatnya apalagi kalau menjadi kolonialnya pasti lebih banyak lagi menikmatinya mudah an tidak ada pihak yg terinspirasi utk menjadi neo colonialis sebagaimana kekhawatiran presiden ri pertama irhsoekarno yg mengatakan bahwa suatu saat indonesia bisa dijajah kembali oleh bangsanya sendiri mungkinkah kerja sama antara penguasa investor asing dan aseng ini adalah sebuah indikasi akan munculnya neo colonialis di nkri mudah an tidak demikian adanya,0,it is also nice to enjoy the results of development from the legacy of the dutch colonial legacy that have been enjoyed by the leaders of the nkri including years enjoyed by president jokowi enjoying the results of colonial development alone is already so enjoyable let also be more enjoying it if we become the colonial hopefully no party will be inspired to become a neo colonialist as worried by the first president of the republic of indonesia irhsoekarno who said one day indonesia could be recolonized by its own people is it possible that this cooperation between the rulers foreign investors and foreigners is an indication of the emergence of neo colonialism in the nkri hopefully it is not so
@koharciamis9114,2024-08-18T06:55:27Z,pasang panel malah rusak hutan,0,installing panels actually destroys the forest
@ajisdoankcf,2024-08-18T06:45:23Z,gojek siap menghijaukan ikn,0,gojek is ready to green the ikn
@sebataskemampuan3077,2024-08-18T06:44:43Z,sejarah baruslama thsatuy istana karya anak bangsabukan warisan koloniald era bpk irjokowidodosy bangga pernah memilih sampeanbiarkan anjing menggonggong lanjutkanindonesia maju,0,new history for years one and only the palace is the work of the nations children not a colonial legacy in the era of mr ir jokowi i am proud to have chosen you let the dogs bark continue indonesia is progressing
@ajisdoankcf,2024-08-18T06:44:20Z,gojek siap menghijaukan ikn,0,gojek is ready to green the ikn
@ajisdoankcf,2024-08-18T06:44:12Z,gojek siap menghijaukan ikn,0,gojek is ready to green the ikn
