author,published_at,comment,like,en_comment
@sugiyantokdr4800,2024-12-01T14:54:13Z,selama pak basuki jadi kepala otorita ikn insaallah ikn akan berkembang dengan pesat dan berlanjut pembangunannya,7,as long as mr basuki is the head of the ikn authority god willing ikn will develop rapidly and its development will continue
@ismani3599,2024-12-01T15:37:10Z,benarrr tetap semangat pak basuki,0,true keep up the spirit mr basuki
@SyaifuddinFuddin-k4t,2024-12-03T10:35:28Z,uangnya dari mana nanti aja,1,wheres the money coming from later
@wijoyokusuwo,2024-12-01T14:52:46Z,ahy end the beest calon pemimpin masa depan,1,ahy ends the beest future leader candidate
@tufo5874,2024-12-01T14:49:52Z,mimpi ya mad indonesia emas,0,dream yes mad indonesia gold
@MalamBagaiSiang,2024-12-01T14:48:32Z,kata nasib itu identik kurang bagus,0,the word fate is synonymous with bad luck
@Rasino63,2024-12-01T14:46:57Z,coba bpk ahy jadi wapres nya mantappp dah,4,try making mr ahy the vice president that would be great
@bayusutrio9778,2024-12-01T14:46:36Z,mantap mas ahy oke gercep,2,great mas ahy okay hurry up
@ardisembiring5704,2024-12-01T14:42:48Z,kelihatan di wajahnya ceria setelah jadi menteri,0,looks cheerful on his face after becoming a minister
@nurindahLestari-ys4hx,2024-12-01T14:42:24Z,waktunya yang muda berkreasi,1,its time for young people to be creative
@AgungKurniawan-k9h,2024-12-01T14:36:43Z,gagalin aja ikn nya pak mentri ibu kota nya di jakarta aja,1,just fail the ikn mr minister the capital city should be in jakarta
@wiwinwinarsih109,2024-12-01T14:49:56Z,setuju banget,0,totally agree
@LisaBatak,2024-12-01T14:51:54Z,betul perbaiki aj kota jkt,0,thats right fix the city of jkt
@Amanah-g8r,2024-12-01T15:18:39Z,jkt terlalu bnyk permasalahan memperbaiki jkt lebih muahall biayanya drpd membangun ikn,3,jakarta has too many problems fixing jakarta is more expensive than building an icon
@tru_inspiration3357,2024-12-01T17:17:00Z,halah lu mah orang jakarta yang ga suka ibu kotanya di pindah kasian lu orang jakarta ibu kota mau dipindah biar pembangunan ga di jawa melulu kita orang kalimantan dan disekitarnya berasa di anak tirikan cuman orang jawa dan orang jakarta ajah yang ga mau pindah wkwk,1,oh you people from jakarta dont like the capital city to be moved poor you people from jakarta the capital city is going to be moved so that development is not only in java we people from kalimantan and the surrounding areas feel like we are being neglected only javanese and jakartans dont want to move lol
@ArifSanjayasaputra-lk2hy,2024-12-01T18:58:16Z,ikn tetap berlanjut dan bertahap,1,ikn continues to grow and develops gradually
@achmadyani8842,2024-12-01T14:35:36Z,pik di evaluasi dan di periksa pak jangan takut sama aseenngg,35,pik is being evaluated and checked sir dont be afraid of aseenngg
@ismani3599,2024-12-01T15:59:23Z,justru pak prabowo yang menginisiasi,2,in fact it was mr prabowo who initiated it
@daengkulle8121,2024-12-01T20:08:59Z,jangan mengada ada dan sok tau,0,dont make things up and pretend to know
@nanangsupriatnaaa123,2024-12-02T01:37:35Z,setuju jangan takut sama oligarki rakyat kecil karna awam di bodohin cukong,0,agree dont be afraid of oligarchy the common people are fooled by the tycoons because they are laypeople
@afkakhalif,2024-12-01T14:34:46Z,calon pemimpin masa depan,1,candidates for future leaders
@Mei39394,2024-12-01T14:34:10Z,ngomng bnyk kerja dong bnykin,1,saying theres a lot of work theres a lot of work
@Mei39394,2024-12-01T14:33:32Z,mimpi,0,dream
@supriadyedy3498,2024-12-01T14:32:45Z,jangan jawa aja ug kalian bangun kami si daerah orang indonesia juga,3,dont just be javanese build us in the indonesian region too
@indrawijaya-x7o,2024-12-01T14:32:03Z,kerja kerja kerja,0,work work work
@BintangjasaTehnik,2024-12-01T14:29:25Z,menteri pak prabowo semua nya berbobot,1,all of mr prabowos ministers are of substance
@Nurulfansbassmalah,2024-12-01T14:26:28Z,gibran juga punya potensi,1,gibran also has potential
@Nurulfansbassmalah,2024-12-01T14:26:03Z,mas gibran juga iklas,2,mas gibran is also sincere
@bamtv7879,2024-12-01T15:40:30Z,yup masalah nya dia ikhlas aja gak paham,0,yup the problem is that he sincerely doesnt understand
@yusramahendra6203,2024-12-01T17:07:51Z,fufufafa iklas,0,fufufafa sincerely
@merisiniwatimatondang4259,2024-12-01T14:25:42Z,dari mana duitnyaapa mau hutang lagi,0,where does the money come fromdoes he want to borrow more
@sofiyanefendi3189,2024-12-01T14:29:10Z,gak usah mikirin itu brootak mu gk akan sampai,3,dont think about it bro your brain wont make it
@Nurulfansbassmalah,2024-12-01T14:25:26Z,siapa pun boleh jadi wapres termasuk gibran,2,anyone can be vice president including gibran
@okeuprimaputra684,2024-12-01T14:21:51Z,ahy cerdas santun,3,ahy intelligent and polite
@MangTri-l1x,2024-12-01T14:20:05Z,ahy di yakini akan jadi pemimpin masa depan,55,ahy is believed to be a future leader
@utimecca4519,2024-12-01T21:16:49Z,lht sj tar jd wakilnya gibran sdh diatur sm jastip,1,lht sj tar jd gibrans deputy has been arranged by sm jastip
@MartabakCiptarasa,2024-12-01T22:24:53Z,aamiincerdas beliau,2,amenhe is smart
@3aries814,2024-12-02T02:46:30Z,pemimpin masa depan itu gibran,1,the future leader is gibran
@HeryHaryadiFitri-yl6qg,2024-12-03T04:49:16Z,hayo bersaing sama fufufafa hahahaha,1,come on compete with fufufafa hahahaha
@PangeranHutauruk-c6v,2024-12-01T14:19:59Z,mantaf pak ahylanjutkan pak,18,great mr ahycontinue sir
@ojolopang6505,2024-12-01T14:17:30Z,ahybaru keluar bintang nya jokowi bisa melihat orang muda potensial nkri harga mati,24,ahyhis star has just emerged jokowi can see young people with potential nkri is nonnegotiable
@haha_huhu...,2024-12-01T14:25:13Z,bandingakan dengan gibran cara penyampain dalam berbicara jauh beda,3,compare it with gibrans way of speaking its very different
@nadazen1957,2024-12-01T14:41:17Z,hahahuhukwkwk masih pakai text dan menghafal dr para pembantu nya,2,hahahuhukwkwk still using text and memorizing from the assistants
@diyaiffa3034,2024-12-01T14:42:53Z,gibran spt bapaknya kok nanya sy,3,gibrans fathers tax return why are you asking me
@FcChoice-yp7nf,2024-12-01T15:18:40Z,ya jahu bedah gibran dengan ahygibran kalau ngomong kayak orang mau ngaisnahan pipis,1,yes im going to have to deal with gibran and ahy gibran when he talks like someone wants to scold him hes holding his pee
@wawanhermawan-xq4lu,2024-12-01T18:08:15Z,manusia ada kelebihan ada kekuranganklo komen jngn begitu emang lo pinter mending gibran jadi wakil persiden,0,humans have strengths and weaknesses if you comment dont do that if youre smart gibran would be better off as vice president
@parilparil7631,2024-12-01T14:15:07Z,tuntaskan kemiskinan dulu pak kalau bisa perkuat pertahanan lebih penting,0,end poverty first sir if possible strengthening defense is more important
@KMD_700k,2024-12-01T14:37:10Z,tuhan aja tidak bisa menuntaskan kemiskinan apalagi manusia,0,even god cannot eradicate poverty let alone humans
@Amanah-g8r,2024-12-01T15:16:10Z,kaya miskin pasti ada klo kaya semua siapa yg akan jualan gimn tuntaskan kemiskinan caranya buka lapangan kerja naikin gajih sekolah kuliah gratis dll,1,there are definitely rich and poor if everyone is rich who will sell how to end poverty the way is to open up job opportunities increase salaries free schools colleges etc
@ismani3599,2024-12-01T15:50:24Z,kalo kamu presidennya,0,if you were the president
@juarnovandega1008,2024-12-01T14:11:45Z,kalau dulu ahy masih setia smaa anies duh kasiandi eranya jokowi lah beliau jadi menteri dan sekarang dijadikan menteri lagi sama prabowo,12,if in the past i was still loyal to anies poor thing in jokowis era he became a minister and now he has been made a minister again by prabowo
@JainAub,2024-12-01T14:40:00Z,kn klo gk sjln sm pk persident prabowopsti dsruh kluar dr kabinetny kn pk persident prabowo blg sendiriy sblmnya dia nolak dn stelah gabung dgn persident k pk jokowi dia djdikn mntriny dn sm persident yg skrg hrs sjln dgn persident ny ap lg ikn hrs dlnjutkn krna itu proyek trategis ngara,5,if its not the same with president prabowo he will definitely be asked to leave his cabinet president prabowo said it himself previously he refused and after joining president jokowis th cabinet he was made his minister and with the current president he must continue with his president whats more the ikn must be continued because it is a strategic national project
@LastriSulastrie,2024-12-01T14:10:59Z,ikn ya harus dilanjut dan diselesaikan krena merupakan harga diri nama indonesia,4,ikn must be continued and completed because it is the pride of the indonesian name
@BambangYudiyanto-iy8io,2024-12-01T15:39:00Z,harga diri jokowi kalii ga usah dilanjutlah investor ga ada ujungnya apbn yg berat biarin jokowi dan jin nya yg lanjutin sndiri naluri dia kan pemborong apa dborong tmsk hak rakyat,1,jokowis selfrespect please dont continue investors will never end up burdening the apbn let jokowi and his genies continue on their own his instinct is to be a contractor he will buy up everything including the peoples rights
@bamtv7879,2024-12-01T15:39:35Z,nggak juga mulyono aja dah gak ada harga diri,1,not really mulyono just has no selfesteem
@SuhadiAnsyah,2024-12-01T14:09:01Z,ini orang bijak pintar dan santun,0,this is a wise smart and happy people
@rafaelchanelayahputra1995,2024-12-01T14:03:53Z,mun waafres kie krek gagh,0,we will not be able to do without crack
@abassudarmoko2187,2024-12-01T14:03:15Z,sebaiknya ikn jangan tergesa gesa lagi yang terpenting kenaikkan ppn jadi dibatalkan saja daripada melanjutkan ikn,0,its better not to rush the ikn anymore the most important thing is to cancel the increase in vat to rather than continuing the ikn
@AraAisarthahira,2024-12-01T14:02:13Z,stop dulu sejahtera kan rakyat,1,stop for now the people will prosper
@EdwardSteven-b9h,2024-12-01T14:01:20Z,ko pada blm ngantor di ikn,0,why havent you gone to the office at ikn yet
@Alexander-v7s,2024-12-01T13:59:40Z,gak usah diterusin ikn proyek gak jelas itu duit buat bangun juga kagak ada,7,dont continue ikn its a vague project and theres no money to build it
@BadarudinFatah-hq9hg,2024-12-01T17:50:59Z,lanjutkan ibu kota harus pindah,0,continue the capital must move
@ArifSanjayasaputra-lk2hy,2024-12-01T18:53:48Z,tetap di lanjutkanudh jelas di pindah koberati jelasklo di pulau jawa tidak memungkinkan kalimantan yg cocok sihdi pisah lebih bgus daripada di gabung di jakartaikn kusus pusat pemerintahan jakarta pusat perekonomian,0,continue its clear that its being moved which means its clear that its not possible on java kalimantan is more suitable separating it is better than combining it with jakarta especially for the center of government and the center of the economy
@M_Herman_Thea.,2024-12-01T13:59:27Z,alhamdulillah anak anak bangsa indonesia ku yang tercinta selalu terus menerus tetap terjaga guna mementingkan kesejahteraan masyarakat rakyatnya untuk memartabatkan bangsa ini nkri dari aceh hingga papua bangga,1,thank god my beloved children of the indonesian nation always continue to remain vigilant in order to prioritize the welfare of the people of their society to dignify this nation the republic of indonesia from aceh to papua proud
@M_Herman_Thea.,2024-12-01T13:59:17Z,alhamdulillah anak anak bangsa indonesia ku yang tercinta selalu terus menerus tetap terjaga guna mementingkan kesejahteraan masyarakat rakyatnya untuk memartabatkan bangsa ini nkri dari aceh hingga papua bangga,44,thank god my beloved children of the indonesian nation always continue to remain vigilant in order to prioritize the welfare of the people of their society to dignify this nation the republic of indonesia from aceh to papua proud
@KhamirahPenyarang,2024-12-02T00:16:52Z,mhermanthea alhamdulilah amin lagian klo saling memberi apa untungnya lur,1,mhermanthea thank god amen besides if we give to each other whats the benefit bro
@KhamirahPenyarang,2024-12-02T00:17:37Z,mhermanthea membenci apa untungnya yo bersatu padu,1,mhermanthea whats the point of hating lets unite
@sadiatisadiati6525,2024-12-02T23:31:12Z,yg tua fukung dari belakang yg sdh jadi pjbt istirahat dahmaju yg muda juga lbh cerdas untuk indo emas yg nyinyir minggir aja ok,0,the old ones are supporting from behind the ones who have become pjbt are taking a break the young ones are also smarter for indo emas the ones who are making noises just move aside ok
@Razi_Maulana,2024-12-01T13:58:41Z,ikn proyek gagal yakin gue ga bakal sukses bukan nya apa terlalu jauh pejabat byk ga pada yg mau pindah sana,1,its a failed project im sure it wont be successful its not too far many officials dont want to move there
@LastriSulastrie,2024-12-01T14:14:46Z,yg gk mau pindah ikn ya kluar aja dri pemerintahanyg mau jg ngantri,2,those who dont want to move the capital city should just leave the governmentthose who want to should also queue up
@ismani3599,2024-12-01T16:11:22Z,itu kan kata anak abah dan gerombolan amin kurais,1,thats what abahs son said and the amin kurais gang
@ArifSanjayasaputra-lk2hy,2024-12-01T18:58:54Z,ikn tetap berlanjut dan bertahap,1,ikn continues to grow and is gradual
@shetiamie8466,2024-12-01T23:12:10Z,kasian gak bisa demo lagi,0,too bad i cant demonstrate anymore
@HasyimAsary-l3g,2024-12-01T13:58:36Z,kalau mas ini sgt meyakinkan jd wapres,2,if you are really convincing you can become vice president
@Sugeng-m8b,2024-12-01T13:55:10Z,jangan lupa terimakasih ke pak jokowi yg angkat derajat kamu kalau ngga ada pak jokowi kamu masih ngublek di parte,2,dont forget to thank mr jokowi who raised your degree if mr jokowi was not there you would still be stucking in the party
@ismani3599,2024-12-01T16:00:49Z,setuju,1,agree
@user-hs9ei1yl4javawood,2024-12-01T13:53:09Z,bohong kesejahteraan masyarakat bapaknya aja ga sanggup membuat sejahtera,1,its a lie that the welfare of society is not even capable of making the father prosperous
@ArcangeloLeite,2024-12-01T14:12:29Z,kapan bisa move on ya,0,when can i move on
@Sugeng-m8b,2024-12-01T13:53:08Z,ahy hati hati kamu ya narasi kamu selama ini selalu narasinya negatif dengan ikn masyarakat sedang memantau kamu pingin banget ya ikn mangkrak terlihat sangat pesimis kamu sama ikn,1,ahy be careful your narrative has always been negative about ikn the public is monitoring you do you really want ikn to stall you see very pessimistic about ikn
@sigitpurnomo1760,2024-12-01T15:08:06Z,yang di omongin ahy itu perintah prabowo boss,1,what ahy said was prabowos order boss
@ArifSanjayasaputra-lk2hy,2024-12-01T19:02:26Z,ikn tetap berlanjut dan bertahap,0,ikn continues to grow and develops gradually
@NotofarmPurworejo-p9m,2024-12-01T13:49:59Z,gagah nya mas ayh semoga kelak jadi ri,8,youre so dashing bro hopefully in the future youll become ri
@utimecca4519,2024-12-01T21:18:39Z,cb kl wakilnya ahy pasti ga ky skrang,0,cb if the deputy is ahy it definitely wont be like skrang
@KhamirahPenyarang,2024-12-01T22:50:50Z,nah gitu aja adem ayem dapet pahala,0,well thats it youll get your reward
@KhamirahPenyarang,2024-12-01T22:51:20Z,utimeccakiyamat kali,0,utimeccakiyamat times
@ridwanrealme6360,2024-12-01T13:49:13Z,masukkk semoga sukses injih bang ahy,2,come in good luck bang ahy
@yunahgwr574,2024-12-01T13:47:29Z,karir dijalani secara step by step ibarat buah biar matang secara alami baru dijual pembelinya rakyat indonesia merdeka,72,career is lived step by step like a fruit that ripens naturally then sold the buyers are the indonesian people merdeka
@tetapsemangat6344,2024-12-01T14:54:49Z,harusnya gitu yaa step by step bukan langsung jadi ah sudahlah,2,it should be like that step by step not all at once ah never mind
@febisaputro2401,2024-12-01T16:28:01Z,bener kaya ahy suka mengonggong dan menjlat,1,its true that ahy likes to bark and lick
@bocahbagus563,2024-12-02T02:35:20Z,tp si samsul dari bocah ingusan yg gagal jd pengusaha martabak langsung bisa jd walikota menjabat wali kota blm kelar bisa jd wapres enak jg ya jd samsul ngk perlu susah payah cari kerja,5,but samsul from a snotty kid who failed to become a martabak entrepreneur could immediately become mayor he served as mayor but before he finished he could become vice president its also nice that samsul doesnt have to bother looking for work
@SanjayaAanjaya-w3k,2024-12-02T02:44:52Z,bocahbagus ia lah enak emang lo cuman jadi benalu wk wk,1,bocahbagus yeah its really good you know youre just a parasite wk wk
@tenjobertani3347,2024-12-02T10:13:33Z,tetapsemangat maksudnya jgn kayak samsul,3,tetapsemangat what i mean is dont be like samsul
@WawanParawansyah,2024-12-01T13:46:46Z,mas ahy orang cerdas dan ihlas semoga sehat selalu dan jadi pemimpin masa depan amin,2,mas ahy is a smart and sincere person may you always be healthy and become a future leader amen
@ninyomansutari2178,2024-12-01T13:46:36Z,semoga semesta mendukung ahy,10,may the universe support ahy
@darmakusuma263,2024-12-01T13:46:04Z,kita sebagai rakyat bangga pada ahy anak muda yang ingin bangsa nya maju,0,we as citizens are proud of ahy young people who want their nation to progress
@ismani3599,2024-12-01T16:14:19Z,sok tau kamu,0,you know it all
@786cyan,2024-12-01T13:42:17Z,andaikan ahy yg jd wapresnya prabowo pasti indonesia damai,5,if ahy were prabowos vice president indonesia would definitely be peaceful
@MarlinaMarpaung-m6r,2024-12-01T16:04:13Z,msih aja ngadu dombapak prabowo msih percaya mas gibran knpe emang masalh buat loe,0,im still arguing mr prabowo still believes mr gibran why
@andikrobandi8166,2024-12-01T21:50:39Z,tp prabowo maunya gibran dan menang low pilih ahy blm tentu menang,1,but prabowo wants gibran and low to win choosing ahy is not necessarily a guarantee of winning
@ricadsitumorang1579,2024-12-01T13:40:01Z,duit semua disana,0,all the money is there
@Riofeb-e6q,2024-12-02T02:12:35Z,iya betul kalimantan bnyk duet lo,0,yes thats right there are lots of duets in kalimantan lo
@bhaktis9233,2024-12-01T13:38:05Z,gus gushambalang aja mangkrak sesumbar mau melanjutkan ikn lawak aja,5,gus gushambalang is still stalled bragging about continuing the ikn is just a joke
@Fatan-cz1vh,2024-12-01T13:56:41Z,anak abah tetap blm move on anies memang yg terbalik,4,abahs son still hasnt moved on anies is indeed the one who is upside down
@ismani3599,2024-12-01T15:43:35Z,padahal hambalang tidak sebesar ikn itu aja mencret eh mangkrak tapi kalo mau dipemerintahan lebih baik lanjutkan ikn,2,even though hambalang is not as big as ikn its just diarrhea and stalled but if you want to be in government its better to continue ikn
@ArifSanjayasaputra-lk2hy,2024-12-01T18:54:12Z,ikn tetap lanjut dan bertahap,1,ikn continues to progress and gradually
@herrypujiono7105,2024-12-02T00:19:33Z,komen basi,1,stale comments
@EllySuhelly-s2e,2024-12-01T13:36:57Z,rakyat indonesia pasti bahagia dan senang melihat para pejabat negara jika bisa bersatu rukun dan damai seperti ini satu visi satu misi yang lilahitaala demi membangun negara dan mensejahtrakan rakyat,211,indonesian people will definitely be happy and pleased to see state officials united harmonious and peaceful like this with one vision and one mission for the sake of building the country and improving the welfare of the people
@KhamirahPenyarang,2024-12-01T22:06:33Z,amin harusnya bersatu sebelum terlambat msh ada kesempatan,1,amen we should unite before its too late theres still a chance
@Gado-Gado-y1l,2024-12-01T23:56:02Z,mereka rukun kox dapat jabatan harta kekuasaan anakanak mereka cucucucu mereka turunan gak miskin dan gak ngerasain makan gratis sebesar ribuan kox,11,they are harmonious they get positions wealth power their children their grandchildren for generations are not poor and do not experience free meals worth thousand rupiahs
@harryyuqie583,2024-12-02T00:04:11Z,bersatu untuk merampok uang rakyat,7,unite to rob peoples money
@KhamirahPenyarang,2024-12-02T00:05:01Z,ellysuhellyse alhamdulilah doa yg baik semoga di hijabah oleh alloh swt amin,2,ellysuhellyse alhamdulillah what a good prayer may allah swt grant you hijab amen
@KhamirahPenyarang,2024-12-02T00:07:59Z,ellysuhellyse iya kita semua hamba alloh mumpung msh bisa menikmati karena umur gak tau smpe kpan mkanya nanem yg baik aj sedulur kabeh semoga bermanfaaf,0,ellysuhellyse yes we are all servants of allah while we still can enjoy it because we dont know how long our life will last so just plant good things all brothers and sisters hopefully it will be useful af
@HasbullahNana,2024-12-01T13:36:54Z,ahy seorang mentri tapi lepelnya lepel wapres,6,ahy is a minister but his face is like that of the vice president
@AsumirahIrah,2024-12-01T13:34:18Z,hutang lagi,0,debt again
@Abigail99596,2024-12-01T13:33:52Z,ada pak rico rustambi my ex boss,0,there is mr rico rustambi my ex boss
@rahmateffendi744,2024-12-01T13:33:16Z,kalau rakyat sengsara menyengsarakan ralyat ikn dihentikan dulu,0,if the people are suffering the ikn must be stopped first
@firman.mulyadi,2024-12-01T13:31:04Z,masyaallah terstuktur dalam penyampaianny,49,mashaallah very structured in its presentation
@muhirfan5735,2024-12-02T02:27:30Z,tersetruktur sambutan secara formal iya bagus tapi soal isi pidato kaya kurang mengena deh,1,a formally structured greeting is good but the content of the speech seems less than appropriate
@330heavy,2024-12-02T02:59:54Z,muhirfandaripada fufufafa wkwk,0,muhirfanthan fufufafa wkwk
@muhirfan5735,2024-12-03T13:20:33Z,heavy hhh bf ya,0,heavy hhh bf ya
@Eti89899,2024-12-01T13:29:00Z,semoga pada amanah yah yg ada di lingkugan kabinet bpk prabowo prexidenku bijn rakyat makmur dan udh rakyat gk sysah pasti org pejabat dlk di jabinet nentri dlk oasti mereka jg mskmur yg pentin jagan padz korupsi,3,hopefully the mandate of those in the cabinet of mr prabowo my president will make the people prosperous and if the people are not satisfied surely the officials in the cabinet and the ministers in the cabinet will also be prosperous what is important is to avoid corruption
@ARFA-24,2024-12-01T13:28:42Z,begron a tni tapi di beri jabatan sebagai menteri pembangunan lagisistem balas budi jabatan belum hilang di bangsa ini,0,begron a tni but was given the position of minister of development again the reward system has not disappeared in this nation
@nurhakim6450,2024-12-01T13:39:14Z,wawasanya luas,0,his insight is broad
@riancy5539,2024-12-01T13:27:41Z,buseehh tema nya tekan kemiskinan lah di kamar sebelah ada tema pengentasan kemiskinan kayak nya ruwet y,0,wow the theme is eliminating poverty but in the next room there is a theme of eliminating poverty it seems complicated
@tumpangyogi4314,2024-12-01T13:27:05Z,lha ini bru tokoh muda yg punya potensi jd ri,5,well this is bru a young figure who has the potential to be jd ri
@MuhammadYudistira-n7b,2024-12-01T13:49:59Z,husss fufufafa tetap yg terdepan,0,husss fufufafa still the leader
@Sugeng-m8b,2024-12-01T13:53:59Z,ogah banyak omong kerjanya lambat mirip anis,2,i dont worry to talk a lot and work slowly like anis
@Seniman_Kampung,2024-12-01T13:25:33Z,srcara fisik mental kedisiplinan dan tentu kepemimpinan wawasan kebangsaan ahy lebih matang daripada gibran,247,physically mentally and discipline wise ahys leadership and national insight are more mature than gibrans
@julianam8262,2024-12-01T13:40:30Z,trus,8,trus
@khoirulumam2586,2024-12-01T13:41:20Z,wkwkw jelas jauh lah bro sama gufufafa,20,wkwkw its clearly far from gufufafa bro
@mas_pooy..,2024-12-01T13:49:27Z,julianampahami tu,4,julianampahami here
@damianae8824,2024-12-01T15:24:54Z,sumiati tapi kan tetep samsul yang jadi wakil gimana dong,8,sumiati but samsul is still the deputy what should i do
@ismani3599,2024-12-01T15:26:00Z,jangan salah bro ahy diangkat jadi mentri di era siapa,8,dont be mistaken bro in whose era was ahy appointed as minister
@ramfamily3292,2024-12-01T13:23:35Z,ahy the nexs wapres prabowo,3,ahy is the next vice president of prabowo
@UndangSunandar-j2v,2024-12-01T13:22:47Z,nasib ikn akan seperti hambalang,0,the fate of the icon will be like hambalang
@ArifSanjayasaputra-lk2hy,2024-12-01T19:01:40Z,tidak sama,0,not the same
@wongranto,2024-12-01T13:22:11Z,udah ahy gk bisa nolak nerusin ikm kalau dulu sebelum masuk di kabinet koar terus masalah insfratruktur berat karena gk sesuai dengan isi hati sebenarnya,20,ahy cant refuse continuing with ikm before entering the cabinet he kept ranting about infrastructure it was hard because it didnt match what was in his heart
@asepsutrisna1448,2024-12-01T13:40:15Z,ngomong apa sih rek,3,what are you talking about bro
@ToniPangaribuan-d5u,2024-12-01T14:20:11Z,udah makan obat,0,have you taken your medicine
@raturania315,2024-12-01T15:10:57Z,maklum dia sering minum cipratan air tinja,2,understandably he often drinks splashes of feces
@FcChoice-yp7nf,2024-12-01T15:23:11Z,gak usah di terusin ikn nambahin hutang sajabiarin saja biar di terusin para jin,2,no need to continue it will only increase your debt just leave it and let the genies continue
@JuryForever,2024-12-01T16:41:29Z,raturaniasaat itu ahy sbg oposisi jd emang hrs kritis krn tdk terlibat dlm proses ikn beda skrg sdh masuk kabinet hrs ikut bertanggung jawab,0,raturaniaat that time ahy was in the opposition so he had to be critical because he was not involved in the ikn process but now he has entered the cabinet and must take responsibility
@jazimsantoso2737,2024-12-01T13:18:46Z,ahy sama cerdasnya dg p wapres gibran,1,ahy is as smart as vice president gibran
@waljiyah3143,2024-12-01T13:22:24Z,markotop top top sama anak mantan pres,1,markotop top top with the children of former presidents
@Eti89899,2024-12-01T13:27:37Z,sayah pigin tawa jadinyah tapik malu,0,i wanted to laugh but i ended up embarrassed
@alirosheno9473,2024-12-01T13:28:34Z,ahy secerdas dan muda gini malah di siasiakan sama abah aniesa dan malah memilih cak omon sebagai cawapresnya,1,ahy who is this smart and young was wasted by abah aniesa and instead chose cak omon as his vice presidential candidate
